post_id,text,label
790082583983955969,  පිස්සාමූ පුස්සා මූ පිස්සු පූසා මූ (ඔයා),1
784774004452298752,ඇයි බොල මේ අපි ඉන්නේ      ,0
1278553168775835648," ලැජ්ජයි, මේ වගේ වෙලාවක පාරිභෝගිකයන් සූරාකාපු ආයතන පරිපාලනය ගැන මොලයක් ඇති සුදුස්සන් පත්කරන්න",0
1360581777484521473,මී මල් යළි පිපුණා  හැන්දෑවේ රන් එළියේ මල් වැස්සක් වැස්සා ඒ වැස්සෙන් පණ බීගෙන මී මල් යළි පිපුණා  මී මල් නම් පිපුණි එහෙත් පුංචි පුතා නැතුවා  ගල පාමුල පරඬැල් පත් තෙමී සුවඳ දුන්නා වැහි රැල්ලට තෙමුණ කූඹි ගුල්වලට ම ඇදුණා,0
985142338354798592,   තෝ මැරිස සෙරමිකා,1
994933221434552320,උකුණෝ ඔලුවේ ඉන්නකොට පස්ස කහන අපේ ආණ්ඩුව එනිවේ බදු ගෙවන ඔබට ස්තුතියි,1
969895139455000576,ශ්‍රී ලංකාවේ අධිකරණ පද්ධතිය  මී හරකෙක් පිස්සුවෙන් දුවනවාලූ  අලියා-ඇයි උඹ දුවන්නේ ?  මී හරකා-උන් එළදෙන්නු සේරම ,1
935941667579932673, සීරාවටම මුන් ඔක්කොම ගෙනල්ලා පෙන්නන්න ඔනේ කාලකණ්ණි හැත්තට,1
1384052444867416072,"* කෙල්ලන්ගේ පෝස්ට් වලට දෙපිට කැපෙන්න , සබ් ගැසීම හා ඒවා ශෙයා කිරීමට එන අම්මෝ ඒක ගැන්සිය  * ගෑනුන්ගේ ඇඟේ කෑලි වර්ණනා කරමින් ඒකි නම් හෙනම බඩුව කියා පොයිය ඇද බා ගැන්සියේ වීරයා වීම  *බ්‍රෑන්ඩඩ් ඇඳුම් පැළඳුම් ඇඳ ෆයිව් ස්ටාර් හෝටල් වලින් කා දමන ෆොටෝ සෙට් එක",0
1212351473457270784,   තෑග්ගෙං තෑග්ග උතුං ලබ්බ කිය කිය එකම ලබ්බද මේ වටේ යන්නෙ,1
1299921236932333568,"   හරකා අපේ කැලේ සතෙක් නොවෙයී, පිටින් ගෙනාපු සතේක් ස්බාවික හතුරෙක් නැහැ ස්බාවිකව පාළනය වෙන්න විදිහක් නැහැ ඒ කාලේ ගොනුන්ගේන් ආර්තිකමය ප්‍රයෝජන තිබුනා, දැන් නැහැ කිරි නැති හරක් කැලේට දානවාද අපේ කැලෑ උලා කාලා විනාස කරන්න, පාරට දානවාද ඉන්දියාවේ වගේ?",0
976140194100469760, ලොල් කෑල්ල නම් මන්දාමම එදා හිටිය හිතූ මයි කවදත් පොළොවෙ,0
613752125303099392,අනේ මාවත් ඔය ජාතික හරි අවජාතක හරි ලයිස්තුවෙන් ඇතුලට දාපන්කෝ! තව කට්ටිය ඉන්නවද   ඈතුලට යන්න බලාගෙන?,1
1468239806572474372," හොල්මන්  එකක් බලනකොට බං කීවේ  එක දිග වැඩී (පැය ක්) ඒකිට බයයි ඒ හින්දා බලන්න බැ නවත්තන්න කියලා  මං නැවැත්තුවේ නෑ, ඒකි ගියා",0
1424741078154977280, යන්නේ කොහෙද  මල්ලේ පොල් වගේ නේ  නිව්ස් එක,0
796879644595134464,අද අලුත්ම ජෝඩ්ඩක් ආව අල්ලපු කාබරේවෙනද වගෙ ජොකා පිටින් පාන්දරම සැරිසරන්න බෑනෙසළු ඇඳන් රඟල එද්දී කෝච්චිය ගිහින්රෙද්ද,1
950238137963315200, ඕක රත්තරං වලින් ප්‍රින්ට් කරත් අපේ පො** හැත්ත හැදෙන්නෑලියනවම තමා,1
1464489169539911685, ඔය කියන්නේ කාබනික පෝර වැඩසටහන ගැන වෙන්න ඕන ඒ වැඩසටහනට මිනිස්සු අකැමැති නෑ ඒක අනාගතය වෙනුවෙන් ගත් මිනිස්සු අතර ජනප්‍රිය තීරණයක් වෙන්න තිබුණ අවුරුදු - ක නියම ප්ලෑන් එකක් ඇතුව හරියට කරා නම් එක කන්නෙන් මුලු රටේම ගොවිබිම් පරික්ෂනාගාර කරන්න ගියපු එකයි වැරැද්ද,0
1265300950585147398," රස්නේ ඕන වෙලා මත්පිට හේත්තු උනා, ඒ හෙත්තුව මිනිහා වැරදියට දැකලා, පවුල් ඈරවුල් උනා, ඒ ආරවුල මත් පිට දුර දිග ගොස්, දෙන්නම ඒක මතින් විසදන්න බැලුවා, ගමේ, නගරේ,රටේ, මේ ගෑණි බොනවා, මිනිහලා ඉන්නවා කථා හැදුනා ඒවා දරාගන්න බැරුව දෙන්නම බොනව ඇබ්බැහි උනා, ප්‍රශ්ණ පිට ප්‍රශ්ණ, ඒ එක බියර්",0
1306461856450719744, මං හිටි බෝඩිමක ඇන්ටි ධූට බනිනො තෝ වේසි මගේ ඔක්කොම ලියාගෙන ඒවයින් කකා බිබී තෝ වේසකමේ යනෝමං මේ කීයක්වත් හම්බකරගත්තම තොට ඉවසං ඉන්න බෑකතන්දර කියනො ආදී වසේන් වලි ඒ ආන්ටි පවුල් වෙලා උපයාගත්තේ කුනුහබ්බ කියාන රණ්ඩු වෙන්න පුළුවන් දුවෙක් ඒකත් වටිනෝ ඉතිං එ නාකි උන්දැට,1
714241619290169345,"අද දවසේ කුපාඩි සෙට් එකක්, තන්හාය ජායතී සොකෝ යකෝ! ",1
1193911639902281730,"අම්මප අද ""ආලේ"" බලන්න යන්න ඉන්නකොට උදේ ඉඳන් වහින්න වගේ තිබිල   එකෙත් ධාරානිපාත වරුසා පෙන්නපු නිසා නොයා හිටියාම මෙන්න වහින්නෙ නෑ කියපංකො රෙද්ද අපි ගියානං හොම්බෙන් යන්න වහීවි",0
1179749056697864194, අපේක්ෂකයන් ගනන වැඩිවෙලා වෙන්න ඇති අවලංගු කරන්න කියන්නේ ?,0
1201958108601339905,මට ඉන්නෙ මං උඹට ඉන්නෙ උඹ තමන්ගෙ වැඩක් බලන් පාඩුවෙ හිටපන්,0
1481937256814645248, මුන් නම් මහ සක්කිලි,1
1090269690511773698,  ඔබේ ජීවිතය අපේ ප්‍රවෘත්ති - අපිට ඔන නම් මකනව,0
1410579409682063365, අපි දැන් ඔයාගෙ වහලුන් ඉතින් ඔයා ඕනෑ දෙයක් කරන්න ලොක්කා,0
874237528395599873,අරූගෙ කටට බැට් එකෙන් එකක් දෙන්න බැයිද,1
910479958342082560,   වල් ඌරා හා සමානවම ඇතාද මඩ නා ගනී කෙසේ වුවත් ඇන්ඩ්‍රොයිඩ් නම් ඇතා ඉදිරියේ  නම් වල් ඌරා හූණු බිජ්ජකි,1
620110324264341505,මහින්දට  නාම  යෝජනා  දුන්න  ඒක  ගැන  සමහර ගිනිපුක්  ගාය ගහපු  සිවිල්  සමාජ  ලබ්බන්ටයි මෝඩ  ජෙප්පන්ටයි  හරි ,1
1263550638308409345,      තමුසෙ චතුර සේනාරත්න ගෙ පොඩි මල්ලිද අයිසෙ,1
1340988238828249088,"""මගේ කොල්ලන්ට අත උස්සන්න එපා එහෙම උනොත් ලොකු ප්‍රශ්ණයක් වේවි!""  - කාලි  අනේ හුකේ නන්නානේ!   මෙහෙව් උන්ගේ රෙද්ද පල්ලට යනෝනේ අපේ වාහෙලත් බෙහෙත් ගන්න කියලා!  නොදෝකින්! නොදෝමකින්!  මේ වගේ ගෝත ජනතාවක් එක්ක කෝමද බන් රටක් හදන්නේ!   අප්පිරියයි",1
1073265325569961984," ,     නායකයා කතා කරද්දි ඒකට මූන ඔබාගන්න දගලන ලපයි සිපයි තූ නොදකින්",1
1035174638068752384,ඔව් ඔකිගෙයි මගෙයි කතා පටන්ගන්නෙ දි ලව ඉවරවුනාට තාම අපි දෙන්න සෙට්වෙලා පිස්සු කෙලිනව සමහරවිට ඩෙන්නගෙන් එකෙක් මැරෙනකම්ම ඒ ෆිට් එක තියේවි,0
1478687770402955265, ඔයාල ලෑස්ති නං අපිත් ලෑස්ති පාර අතුගාන්න ,0
1182338961064095744, පාර පොඩි කරයි එහෙනම්ඒ වගේ හරක් ටිකක් නේ,1
767277071815086080,පැටියා බේරගන්න මී හරකා දාන සෙල්ලම  අම්මාගේ ආදරේට කරන්න බෑරි දෙයක් නෑ -  ,0
1209472021253574657, ඉස්සර වෙලා මෙහේ බස් එකක ගිහින් ඊට පස්සේ කථා කරපං ගොං හරකා හිතං ඉන්නේ ඔක්කොම දන්නවා කියලා,1
1130347607048372224,"වෙසක් එකට ගෙදර ඇවිත් ආපහු යන්න හදද්දි අම්මා කියනවා  ""හදවතෙන් භාගයක් ගියා වගේ තමා, පොඩි එකී නැත්නම් පිස්සු හැදෙනවා"" කියලා  යන එකත් එක්ක එපා උනාඒත් අම්මේ රස්සාව කොරන්න නොගිහින් බෑනේ",0
1242731112025059328, අනිත් අයටත් ඉක්මන් සුවය ප්‍රාර්ථනා කරනවා,0
726671124717703168,"""කවුද දන්නේ නෑ උසස් පෙළ විෂය නිර්දේශයට ගිරා සංදේශය දමපු හරකා - අධ්‍යාපන අමාත්‍යංශයේ ඉන්නේ ගොන්නු ගොඩක් "" - තමන්ගේ ",1
607551442958753792,  පට්ට කෑල්ල නේ :  ,0
1478533455453429766,"පච්චයක් ගහනවා නම්, ගහගනින් පපුවේ හරහා  ""උන් ඔක්කොම යාලුවෝ මල්ලි""  කියලා නැත්තම් තොපි හැමදාම රැවටෙනවා",1
1055790912062681093,ටහුඩු!! මමත් ඉන්නවා   කවුද බං මෙව්වා හඳන්නේ??      ·    රතුමකරා මහරෑකතිකාව එක්ක එකතු වෙන්න අපගේ ආදරණීය ට්විප්ස්ලා ගොඩාක් ඉන්නවා අපිත් එක්ක                     '       ,0
1482294277090979845,ඇයි ඩාලින් ඇගිලි කහපාට? න ගමන් බෝම්බයක් වත් පෑගුවාද?     ·  ,0
944614598887403520,  එකේ ට්වීට් දාන්නේ බඩේ අමාරැ කාරයෙක් ද කොහෙදබාගෙට දානවා දුවනවාඅපි මෙතන පුක ඉරාගෙන දඟලන්න ඕනේ,1
1108788143321436161,විල්පත්තු ----------  ජාති ආලේ ගත්තු කැරි නර සත්තු කළා ගිනි පත්තු  හේත්තු වී මායිමට විල්පත්තු ඡන්දෙට බැලුවේ ඔත්තු බොරු කෙබර අතේ පත්තු තොපි කැව්ව ද වඳ කොත්තු ඌරු පුකට දැන් දීපිය තොත්තු,1
1245016021733261313, බලං හිටපංකො ලොකෙ වටෙ හුක හුක යන රස්සාවක් ලැබුනාම,1
950966148492767232, දහවෙනිදා වෙනකන් දෙන්න නෑ ,0
1191683217411194880,දැක්ක ගමන් හිත බැඳුනා රෙද්ද කඩන් බිම වැටුනා වාසනාවෙ දොර ඇරුනා  සොයා සොයා ආවා ඒ සෙව්ව මැණික හමුවුනා ,0
582260368912699392,"   ඇත්තම කියනවනම් බං, සිංහල අපි උඹ ගැන ආඩම්බර වෙන්න ඕනේ උඹ සිංහලෙන් ට්වීට් කරන එකට      ",0
798491968795975680,   පිංගොනා අහනෝ තෝ වැස්සි ඔන්ලයින් ඩ කියල යාලුවට කියන්න,1
587599826407202816,"  පිස්සු හැදෙනව මේකට,        ",0
1352322997793640449,"ඒයි අඩෝ මේ අහපල්ලා  ගෙම්බට අර හල් ""ම"" යනු බල්ල අහුවෙලා දැන් ටී එල් එක කැත කරගෙන යනව දැකල තමා මේ හදිස්සි ටුවිට් එක දැම්මෙ හම්මෝ හති",0
659264256156667905,තොට ඇත්තන ඇට කැවිලද ගොං වස්සියෙ කොටි බෝම්බ ගහල මිනිස්සු මරනකොට උඹ හිටියෙ රුවන් තොටිල්ලෙද බොල ,1
1087289900204986368,ටහුඩු ලෝගන්ලා දෙන්නයි  _   ·    දෑස් දිහා බලලා වශී උනා කියන්න එපා,0
1325815593950351366,"මතකද පොඩි කාලෙ ගණිතයට , ලබ්බ සමච්චේදනය කලා",0
1018439576094773248,"  ඒ අළු වලින් ගොයම් ගස් පෝෂණය වෙලා හැදීල එන පිදුරු වලින් හාෆ් ශීට් කොළ හදයිද, ටොයිලට් පේපර් හදයිද, හාෆ් ශීට් කොළහැදුවට අව්ලක් නෑනේ බං,  අම්මට හුඩු, එතකොට ටොයිලට් පේපර් හැදුවොත්?     එක එකාට පස්ස පිහදාන්න ටොයිලට් පේපර් හදන්න මම හමුදාවට යන්නේ නෑ යකෝ",1
1356852229534326787, බූස්ට් කරල නේ තිබ්බෙරටේ ආර්තිකය    ගන්න යද්දී කොටස් වෙලදපොල කොහොමද  ඔච්චර නගින්නේතවත් ආතල් එකක නිමාව,0
1122024595710717952, ඊලග විනාඩියෙ එයිද ට්විට් එකක් ප්‍රශ්නකර නිදහස්කරා කියල,0
1125374363467952128, එහෙනම් අර හදන්නෙ මොකක්ද?¿,0
1348277667339116549,      හෙලුවෙන් මෙතන දඟලන්න ගත්තම බිජ්ජෙ සයිස් එකක් ඇටදෙකේ බරයි මිනිස්සු මනිනවා ප්‍රෂ්න තියෙන ඒව කතාකරල විසදගනිල්ලරෙන පුකට කැටයන් දාල වැඩකුත් නෑනේ නේද,1
768363956515643392,ගෑණි නයා වෙද්දි - ශිවන්‍යා නම් පොළඟා නය වෙද්දි - පොළන්‍යා  ලොල් ඕයි     :    ·      පොළන්‍යා,0
1319844977535373312,  එක පැත්තක තියලා මේ ලෙඩේ සමාජගතවෙලා කිව්ව නම් ඉවරයිනෙ මිනිහා මැරුන ගෑණි වගේ මුන් අඬනව අඬනවා ඉවරක් නැනෙ,0
795662694443413505, අත පය නැතිව දරුවෝ මගෙ බඩගින්නේ රට ජාතිය ද බොල උන්හට කන්නට දෙන්නේ හිතේ ඇති ඇම්මටයි මං හමුදාවට බැඳුනේ බඩ වියතට වඩා වැඩියෙන් නෑ මැන්නේ,0
978541117846183936,"පපී කිව්වම අනා හුරතලෙ, බැල්ලි කිව්වම මල පැනලා කුනුහබ්බ කියනො අනේ යකෝ",0
1414092748706041860, ඔවු කොටුවේ සහ ගාලුපාර දෙපස ඇතිවන තඩි ටවර් වලින් සිටි එක ලස්සන වේය කියලා හිතන් අමාරුයි ඊට ලස්සන වෙයි සීමාවන් දාලා වැඩේ කලානම් මේ වගේ අවුට් එකක් ගන්න නම් සීමා දාලා ඒවා මෙව්වා කරන්න ඕනි,0
1370184675415711753,"   අහ්හ් කපුටා ඇහැරලද? ඔයාට ඒක තේරුම් ගන්න බෑ සුප්පා  බල්ලා කවුද, මැක්කා කවුද කියලා කසුනායියා තේරුම් ගනී",0
934801410029268992,මගෙ ඉන්ටෙර්නෙර් පට්ට ස්පීඩ් අද,0
584999723787915264,පරාක්‍රමබාහු කොළඹ  ඇවිල්ලලුනොදකින් එකෙක් නෑනේ රාවණා වෙලා එනතිරේට ලුණු ඇබුල් එක්කම කියන්න තිබ්බා,0
615489175106629633,දිනු දේශය අනතුරේ යකෝ | සුනිල් රත්නායක තීන්දුවට විරුද්ධ අය රොෂාන් ද සිල්වා තීන්දුවට නිහඬ ඇයි?    ,0
1168390259073150976,සෙක්කු වීදියේ කිම්බා දැක උඹ මට මතක් උනා කයිමන් දොරකඩ ඉඳපං මං එනතුරු සෙලෙස්තිනා (  ),1
1053657901544296448,නෑ නෑ ට්විටර් නෑ ඒකි,0
591498338781908993,අපි කැමති අය අපිටත් කැමති නැනේහ්  එහෙනම් අපිත් මානසිකව වැටෙන්න එපයි අපි මේ ඉන්නේ පට්ට ෆිට් එකේ,0
1459010271712739328, කර්මාන්ත ශාලා ගිනිතියල ජෝගි නටද්දි ඔහොම හිතුනෙ නෑ?,0
1273215612475437058,"මතක තියාගනිල්ලා කොල්ලනේ මින් පස්සේ උඹලා බිජ්ජ පිපුරුවත් කමක් නෑ, පාරවල් වල , ගස්වලට, පඳුරු වලට හුජ්ජ කරන්න එපා පරිසරය විනාශ වෙනවලූ ආදි මානවයා හිටියානම් ඌ මානව හිමිකම් යනවා මේවා දැකලා   එන්න අපිත් බිජ්ජ පුපුරවාගෙන පරිසරට සුරකිමු  පරිසරවේදියා",1
891643855447048192, හුත්තෝ හම හුත්තම රිට්වීට් කරන්න එපා පකෝ,1
789451060427403264,ඔහොම හිනා වෙනකොට උඹ ලස්සනයි උමා,0
1365456861843968000, දැන් මේකෙ හැටියට මැරුනේ කවුද? මනාලියද මිත්තනියද?,0
1200373288658182144, අස්සයා පැන්නට පස්සේද  ඉස්තාලය වැහුවේ ? ඇයි මේ බයිස්කෝප් සංදර්ශන !!!,0
1229298095340576768,"එතකොට  කරගත්තු උන්ට ආශිර්වාද කරනවද දන්නෑ   ඔය ඉන්න හාමුදුරු ගොල්ලොම තමා අපහාස කරගන්නේ කටට එන දේ ඔහේ කියලා      ·    අපහාසයක් නෙවෙයි, හිතුණ දේ  හාමුදුරුනමක් බණට කියනවා වෙඩිමෙදි අෂ්ටක කියනකොට දෙවියෙක් ඇවිත් කපල් එකේ වර්ජිනිටි චෙක් කරලා උන් වර්ජින් නෙවෙයි නම් උන්ට සාප කරලා යනවලු   මට තියෙන ප්‍රස්න,  ) සුද්දන්ගෙ වෙඩින් වල දෙයියා එන්නැද්ද? ) අෂ්ටක නොකියා වෙඩිම ගත්‍තොත් දෙයියා ඒත් එන්නැද්ද?",1
1484414816806932481, අම්මාගේ  කැපකිරීම් සිමෙන්ති කඳුලක් නෑ කාලකණ්ණි තුප්පහි සක්කිලි ආණ්ඩුව,1
1146596293587984384,මේවගේ බැල්ලි යන්ට අපි උත්තර දෙන්න පසුබට වෙන්නේ නැහැ ශෙයාර් කරන්න    ,1
1209726565707329536,හැමදාම පුද්ගලික වාහනේ ගමන් ගිහින් ඉඳලා හිටලා ආතල් එකට බස් වල යන අයට නම් බස් සින්දු හෙන කික් ඇති ඒක කොච්චර කරුමයක්ද කියල දන්නෙ උදේ හවා බස් වල බඩගාන මිනිස්සු තමා,0
666180973554327553,රටට කෙලවා ඇමරිකන් ඩොලර් වලින් ආතල් ගන්න අළුත් පරපුර හා නාකි පරපුර ,1
914835821613735936,"රෑ එළිවෙනකං ක්ලබ්ගානේ බිබී ඇවිදින දික්වැල්ලයයි, නාකි හේරයි නොහිටින්න මැච් දිනයි මේං කියලා",0
598992211250810880,   උඹ අරන් පලයන් ටික දුරක් ඩ්‍රයිවර් ට වාහනේ නිදා ගන්න කියලා :- අපි එක පාරක් එහෙම කලා ඩ්‍රයිවර් බීලා නිසා හයර් කරපු වෑන් එකක :-,0
1143441393794158593,ආශික්ලන්තයේ ආශ්චර්යය   'ව්‍යාපාර කරන්න දන්නැති නම් දැන්ම ඔබේ ගමෙත් පටන්ගන්න' 'පොන්න වඳුරු රැලට එක්වෙන්න'         ·       ()       '   '    !!   ,1
935364427632791553, මිල පාලනය කෙසේ වෙතත් පෞද්ගලික රෝහල් දෙන සේවා රජය නොමිලේ දුන්න නම් ඉවරයි ඕවා පාලානය වෙනවා,0
913794843960373249,චීනය වගේ නොදියුණු නූගත් රටවල මේ වගේ මෝඩ තීරණ ගන්නව නේද ප්‍රෙන්ස්? ,0
1067085402849206272,ලස්සනම් පස්ස   රත්තා   ·    ටුවිටර් එකේ ඉන්න තඩි පස්සක් තියෙන කෙල්ල කවුද?   ,0
1053322390401249280,කහපාට රෙද්දකින් තඩි පීප්පයක් ඔතා තිබූ ඒ අවස්තාව,0
1311867589396582406,"යහපාලන ආණ්ඩුව තිබ්බ කාලේ විපක්ෂයේ ඉද්දි; සීනිගම, කතරගම වගේ් තැන්වලට ගිහින් ආණ්ඩුවට විරුද්ධව පොල් ගහපු එක කැරකිලා මේ / ආණ්ඩුවට සාප වුණාද මන්දා",0
