post_id,text,label
837944502962659328,"   සදුන්_අයියා හෑශ්_ලකුණු හැම පැත්තෙන්ම  අෆේ අම්මා කියන්නා වගේ මේක ""සිරි ලංකාව යකෝ""",0
994622485004865536,"අනිත් එක රටේ සල්ලි තියේද දුවට හෙලිකොප්ටර් රෙන්ට් කරන කම්පැනි, ඉවෙන්ට් මැනේජ්මන්ට් කම්පැනි, නෑදෑයින්ට ඉඩම් විකුණන ආයතන එහෙම දාල දුන්නම පව් නොදී යනවල අයිසෙ  තමුසෙලගෙ වලවල් වලටත් හෙන ගහයි ඕයි මිනිස්සුන්ට මේ දෙන දුක් වලට",0
765437651432247296,"""පාලකයිනි තොපි පොන්නයෙක් වුනාට රටේ ඔක්කෝම පොන්නයෝ නෙවේ"" -   නොවටින ලපයි සිපයියන් ඊයේ ""සිංහලේ"" වෙනුවට එකම ",1
715019979393863681,   අඩො බර්ත්ඩේ එක දවසේ පු* පලාගන්න ආසද :,1
884587302692962304,"""අවදිවන්න අවදිවන්න දීප්තිමත් දි""  ""ඔය ලයිට් එක ඕෆ් කරපිය ගස් බල්ලෝ තොට දීප්තිය පෙන්නන්න කලින්""    සුඋ ට්විටර් වාසීනී",1
807478122266271744, මොනාද අනේ මේ අහන කැත කතා  මගෙ උප්පැනත් නැතිවෙලා තීන්නේ,0
1071736139743035392,ටහුඩු ඒක    ·     කියන්නේ ආගමක් ලු  වැටිලා ඩිස්ප්ලේ එක ගියොත් තියන්න වෙන්නේ බෝදි පුජාතමයි   ආගමක්,0
1290921531418144772,"   වේසකමේ ගිහින් ජාතක වෙච්ච උඹ, අම්මගෙන් අහපන් පුලුවන් නම් එදා ඇනපු එකාගේ එක හිට්ටේ හරහටද කියලා පොඩ්ඩක් ඊට කලින් පොඩ්ඩක් හොයලා බලපන් එදා කීදෙනෙක් ඉදලද කියලා එතන අනිවාර්යයෙන්ම බිජ්ජ කොට එකෙක් ඉදලා තියනවා ඒකයි උඹ දකින හැමඑකාගෙන්ම ලොකුද පොඩිද අහන්නේ",1
1427648316779663368,"'බෑ'කියලා නැට්ට උස්සලා කොඩිය දාලා යන්න යනවා මේ ඔක්කොම නිකං චිත්‍රපටියක් වගේ මට පෙනුණාඒ ඔක්කොටම උඩින් දිව එළියට දාලා හිනාවෙවී හිටියේ සුදු ඇගේ කළු ඩොට් තිබ්බ 'සැප්' බල්ලාකිඹුල් බනිස් අරන් දුන්නට පස්සෙ කන්න කියලා කොට්ට යට,මෙට්ට යට ඒවා හංගන පිස්සු බලු තඩියා මං හිතන්නෙ මේ ඔක්කොම",1
1283385246847651843,අපෙ දිහා ඇන්ටි කෙනෙක් කසිප්පු විකුනන්නෙ! අම්මො පිස්සු හැදෙනවා බිස්නස් එක්ට! සැහෙන පවු කරගන්නවා නොමැරෙන මිනිසුන් සේ,0
1428658998090387460, කොහොම හරි විපක්ෂයේ සහ පොදු මතයට කීකරු වෙන්න උනා (රිවස්) මානාහිමි වරුන්ගෙන් ලියමනක් අරගෙන වැඩේ ෂේප් කර ගත්තා දැන්වත් පරෙස්සම් වෙන්න අපේ මිනිසුන්,0
1243177177027248128,කවුරු දැම්මත් හෙන ගහන ඇත්ත,0
1281440880751259648,ගෙදරට ආපු නෑයෝ මං පිලිගන්නා ආකාරය ▪︎කටහඩින් කෞදැයි ආවේ කියා හදුනාගැනීමට ට්‍රයි කිරීම ▪︎දොර රෙද්ද ඈත් කර ආවේ කෞදැයි හොදින් බැලීම ▪︎දත් තිස්දෙකම විලිස්සා සිනාසි ඔවුන් පිලිගැනීම ▪︎එයාලගේ කතාවලට පෝර දැමීම සහ සිනාසීම ▪︎ආපු අය යන්න හදනකොට සට ගා නැගිටීම ▪︎ගෙනාවේ මොනාද බැලීම,0
1001284218704379904,   ඔයිටවඩඩා හොඳයි උඹ මට පොන්නයො දෙන්නෙක් දම්මල කුඩවලින් ගැස්සුවනං ගේ ඉස්සරහ,1
1192150695807315969, ජාතික ලයිස්තුවෙන් ආව එවුන් රඟනවා  ඉන්නහිතෙනරටකට  ,0
1185556930648920064,අනේ මගේ  ටික පිරිලා කොහෙද යන වල් බල්ලෙක් මගෙ පුක ලෙවකන්න හදනවා    කන්දෙමල්ලි,1
1200712473990483968, ඔය වේසිගේ පුතාලා දන්න මාධ්‍ය මුන්ට සල්ලි දෙනවා කිවුවොත් අම්මලා උනත් වේස කමේ යවනවා  හරිය ඉගෙන ගෙන වත් නැති ගොං කලා උපාධි ධාරියෝ ටිකක් රට විකුණං කන්න අටවපු එකක් ඕක,1
1479111894224945160,නොදකින් මලීගෙඉස්කෝලෙ ටැග් එක කියවන්න ගිහින් බලනකොට මේකෙ උන් ටිකක් ඒක ගූ කරලා   පැසිව් එන්ගේජ්මන්ට් ගන්න ඒ ටැග් එක පාවිච්චි කරන්න එපා යකුනෙ ඒක ආසාවෙන් කියවන්න යන මං වගේ උන්ට තොපේ ලබ්බවල් කියවන්න ඕන්නෑ  ඒකෙ දැන් ටීචර් දාන ට්වීට් වලට වඩා වෙන උන්ගෙ ට්වීට් නෙ තියෙන්නෙ,1
1279734890427285504,  එක පිස්සු කෙලිනවා  මේ හොඳට තියෙනවා ටික වෙලාවකින් මිසින් ආපහු  වලින් ගිහින්  කරනවා,0
1354064130743951363,මාසයක් මුසලයා වගේ ඔහේ ඉඳලා අද ඇවිද්දා  වම් කකුල හොඳටම රිදෙනවා බත් කෙන්ද කිට්ටුවෙන් නහරයක් තෙරපිලාද මන්දා,0
1423853886205399041,ඉස්සරහ ගෙදර ඉන්න මෝඩ මූසලය උදේ පාන්දර කොහේහරි ගිහින් ඇවිල්ලා උගේ ගෑණිට කියල ගේට්ටුව ඇරගන්න හෝන් ගහලා පානදර නිදාගන්න ගියපු මාව ඇහැරෙව්වා,1
1304046590315958275,එයාර්ලයින් එකක් නොදකින් විතරක් ලංගම ඒ දවස් වල දුවපු ලටෙක් බස් තඩි මීට වඩා හොඳයි කමක් නෑ ලංගම බස් උඩින් යන්නේ නෑ නේ හිත හදා ගත්තා කෑම ගන්නෙත් ඉස්කෝලේ කැන්ටිමෙන් වගේ සල්ලි ගෙවලා මුංගේ රෙද්දේ ප්ලේන් කියලා මම කිව්වා අපේ එකෙක් අහනවා දෙලොස්දාහට උඹට බිස්නස් ක්ලාස් එකේ,1
1333403421567713282,අර බිනුරයා දාන ගොන් නැටුම් කෑල්ල මොකක්ද,1
1160975942103293957, අපොයි මෙහෙමත් මොඩයෙක් ජනදිපති අපෙක්ශකයෙක් මීටවඩා බුද්දිමත් විදිහට කතාකලයුතුයි,1
890844410488946688,ලංකාවේ බෝල ඇහිදින්න දාපු පොඩි කොල්ලා බෝලේ අල්ලලා දාන්න යද්දී විරාත් කෝලි කරපු කැත වැඩේ -  ,0
1405934413486067717, මොන පම්කියෝද බන් මේ රට පාලනය කරන්නේ?,1
1114583612119064576,   ඇයි පකෝ  උදව්වක්නෙ කරන්න හැදුවෙ,1
1277247411652444160,ඕයි    එදා රෑ මං සාප කරාට පස්සෙද කකුලට කෙල උනේ?,1
616519409436225536,එදා රෙද්ද උස්සගෙන ආව මැතිවරණ කොමසාරිස් අද කෝ මෙය ගැන එදත් අපට  හිතුන  ,1
1160859826542374912,      පුලුවන් නම් ගලවල පෙන්නපන් තොගේ බිජ්ජ කපලා  ගහවි! වහල් රිලවා!,1
1354584352689057794,   වෙනිද ට පුකෙන් හිනාවෙන්නෙ මම මෙහෙමයි මේ සෝෂල් මීඩියා ඉන්නෙ සමහරු ගොඩක් ලොකු දහම් දැනුමක් තියෙන අය නෙමෙයි  ඉතින් මේ චීවරධාරිය ගහපු ගැටේ දැන් මෑන්ටම ලිහාගන්න අමාරු වෙලා ඇඟ පත හැම තැනම ගූ ගාගන්නව (/),1
1062588833353555968, හබරල කොල හිල් වෙන්න හුජ්ජ කරන්න ඉතින් අලි පයියක් වෙන්න ඕනේ,1
1262437763569168384, තෝ පලකො තොට මූඩ් එක හරි ගියාම හැම එකාවම විහිලු නැත්තං අපි වැරදියි,1
795334284970180609,මේ රටේ හුකන්නෝ තනිකර පිස්සු හුකන්නෝ!  ,1
935014279975018497,පිලිකා රොහලේ අයට තැබිලි දන්සලක් දුන්න ගැනු ළමයි කට්ටියකගේ ෆොටොස් අරන් අමන පොස්ට් හද කාලකණ්ණියෙක් දැක්කානොදකින්මුන්කෙල්ලෙක්ගේ ඇදුමක වතුර ටිකක් ගැවුනත් කුණුහරප,1
743012528880373761," ""  : ශ්‍රී ලංකාවට ඩොලර් බිලියන ක විදේශ මුල්‍ය ප්‍රතිපාදන  """,0
973919596645240833, මුලු මහත් සමාජය ඉදිරියේ විකටයන් වූ කල එය දරා ගත නොහැකි වූ හයපාලනයට;තමන් ආන්ඩුවට පත් වූයේ සමාජ ජාලා නිසා බවත් අමතක වී ඇත,0
1474660651532439552,   තමුසෙගේ එකවුන්ට් එකට ගියාම බලාගන්න පුළුවන් තමුසේ මොන ලිංගේද කියලාමට වේසි කියන්න තොට මොන හයියක්දමට වුන් මොනරෙද්දක් කර ගත්තත් කමක් නැමාගේ පොඩි එකා එක බලන් අහපු ඒවට මට උත්තර දෙන්න පුළුවන් දඅනික මිනිස්සු දාහක්යන  බස් එකක උන් උන්ගේ හැඟමි එලි පිට දාන් ගියාම මිනිස්සු බලන් නැද්ද,1
1441459118020050951,"අර යකාව  එකට ගත්ත දවසේ ඉඳන් අපේ ලංකා ටීම් එකේ බෝල් කරත් අඩි,  එකෙත් අඩි  පුදුම කරුම ටීම් එකක් ඕයි",0
1370044578623934464,   අචිනි නම් ඔයා තරම් නපුරු වෙන එකක් නෑ නේද    ඩාලින්,0
1139590528453042177, කෝ ඉතුරුටික ?? කෝ උඹ වතුර සොය සොය ගේ වටේ දුවන කෑල්ල ??,0
1466675651277033474," භයානක නව ප්‍රභේද නැවැත්වීම සඳහා කොවිඩ්- මුලිනුපුටා දැමිය යුතු ය  භයානක නව ප්‍රභේද නැවැත්වීම සඳහා කොවිඩ්- මුලිනුපුටා දැමිය යුතු ය කොවිඩ්- හි ඔමික්‍රෝන් ප්‍රභේදය මතුවීම, රෝගය පැතිරීම නැවැත්වීමට අවශ්‍ය අගුලු දැමීම් සහ අනෙකුත් තීරනත්මක මහජන සෞඛ්‍ය පියවරයන්ට විරුද්ධව ධනේශ්වර ආන්ඩු විසින් ක්‍රියාත්මක කරන ලද රංචු ප්‍රතිශක්තිකරන",0
1485901701832134656, මොනවද ඕයි මේ   නෙදකිං,0
1441428659202494464,ඒ බල්ලා මම උනානන්      ·    ගීතිකාප්‍රන,0
1289212321567449089,මේ වේස පකයො රැස්වීම් තියන්න රතිඤ්ඤා පත්තු කරනවාසත්තු පණ බයෙ දුවනවානද්දකින් ගොන් පක්කු!,1
958961335777222656,   මට උඹ වගේ සිඹින්නෙක් ඇසුරු කරන්න නම් ඕනෙ නෑ බං  උඹලා රෑට ෆෝන් එකට වැඳලා නිදාගත්තට ඇපල් වල ඇති ලබ්බක් නෑ බං සෙකියුරිටි ඇරුනම උඹගෙ ඔය ෆොටෝ ස්ට්‍රීම් එක  ඉවර උනාම මොකෝ කරන්න හිතං ඉන්නෙ,1
1252927947368878080, 'තමුන්ව රට පාලනය කරන්න තාම සුදුසු තත්වයක නැහැඊට පෙර මොන්ටිසොරි යවන්න ඕන,0
596642249175212032,   ඇයි උඹ මීට කලින්  දැකල නැද්ද? නිකන් පුක නොදී පලයං මිනිහෝ : :,1
649605263415111680,   බැන්දා කියන්නෙත් මැරුණා වගේ තමා ඒ හින්දා පලයන් එහේ,0
1167379379837689856, දුප්පත් අය වැසිකිළියට දැමිමද,0
827850092799332352,පට්ට සැපක් අරන් සල්ලි දෙන්න බෑ කියා සද්දේ දාපු පොලිස් ලොක්කා අතේ මාට්ටු ,0
1412852107439337473, ඕක දීලා ආයේ පැතිරෙන්න ගත්තාම ඒවට වියදම් කරන්න මෙයාලා සල්ලි දෙනවා ඇතිපොඩි සෙට් එකක් වෙනුවෙන් ගොඩක් අය අමාරුවේ වැටෙනවා,0
1307694180899012608,තාම  බලනවද වගේ මරි මෝඩ ගොන් කතා අහන්න එපා  නම් ඕන මඟුලක්,1
774202971269857280,මහ කොමසාරිස්ට තඩි බෑ දෙන්නෙක්ට ඇප |  ,0
706103272839446528,"යමපාලන ශබ්ධකෝෂය:  අරකා, මේකා, අයිසේ, තමුසේ, ගෙම්බා, රීරියකා, බල්ලා, පාදඩයා, කලවැද්දා",0
944791507822837760, විභාගයට මෙවර පෙනී සිටි බව විභාග කොමසාරිස්තුමන් විසින් විශේෂ මාධ්‍ය සාකච්ඡාවක් පවත්වා සඳහන් කර ඇත විභාගයෙන් විශිෂ්ඨ දක්ෂතා පෙන්වන පාර්ලිමේන්තු මන්ත්‍රීවරුන් හට ඇමති ධූර ලබා දීමට ජනාධිපති මෛත්‍රිපාල සිරිසේන මහතා බලාපොරොත්තු වන බවට තව දුරටත් ඔහු එහිදී ප්‍රකාශ කර සිටියේය ,0
1019410059623710720, යකෝ ගුලි කාපු එකාවගේ ඔහොම හිනා වෙන්ඩ එපා බොල   පට්ට ඩිපි එකක්ද,1
798163991755362304,හදේ පොටෝ ගැහුවා  ඉතින් හරියයිද කියහන්කො පැහැදිලි නෑ රෙද්ද,1
1448270381832232964, පව් මෙ තඩි පොඩි එකා,1
1293989099016269825, සුදුසුකම් සහිත දෙමල සිංහල කවුරිත් හිටියෙම නැද්ද හලෝ? ගෑනු උදවියත් නැද්ද? තමුසෙගෙ අයියන්ඩිගේ ගෝල බාල පුක ලෙවකාපු සැට් එක විතරයි මෙතන නේද?    ,1
605072231568404481,නාකි වාසුට පිස්සු තද වෙයි පිස්සව අංගොඩ නැයැව්වොතින් අනිත් අයවත් හපා කයිද දන්නෑ අද අගමැතිට බැනලා දැන් ඒ පාර ,1
1446490090729926660,සිවිලිමේ ඉන්න කලවැද්දගෙ බිජ්ජ හැලේවා!  පරයා,1
1159059011364196352, තව ඉන්නවා හැන්ගිලා හොද මුහුනු පෙන්නගෙන,1
828814795524562944, කැත  එක  බ්‍රෝ,0
1402876980102668292,   ටහුඩු කවද්ද නිරෝදාන ඉවර වෙලා ගෙදර ආවේ,0
1212253938730328064,   වැඩ පස්සෙ එන්නම්පලවෙනිදා කාලකණ්ණි වෙන්න බෑනේ,0
1211532826291556352, බූරු හරක් දන්නේ ජාතික කියන එකේ තේරුම හෝම්ස් මහත්මයා ජාතික කියන්නේ ඒ ඒ රටවල් වලට අදාල අනන්‍යතාවය ඉතින් අපේ රටේ ජාතික භාෂාව මොකක්ද? සිංහල නෙහේ ඉතින් ඔය පොන්න සිපයියන්ට තේරෙන්නේ නැත්තේ මොකෝ ජාතික ගීය ගායනා කරන්නේ ජාතික භාෂාවෙන් කියලා පන්න පොක්කු,1
1254646329243992067," ,     උඩම එක කියවල බලන්න  - පයිය සයිස් -",1
1124660388430323713,   සබ් බැරිනං මොක ගැහුවත් පුක පුකමයි නංගී,1
1411996714030878730, මල්ලි/නංගි ඕක ඩිලීට් කරන්න නැත්තං බොරු ප්‍රචාර කරනව කියයි,0
634029568601362432,උපුල් නුවන් විදහා ඔබ ගොනා උනා  මම සිනා සුනා,0
1183679706366763008, යකෝ  වල           මගේ සීයා හිටියා නම් දැන් ක්ඒ මනුස්සයා මේ පිස්සා එක්ක වැඩ කරන්නේ නෑ ,1
1221327854824280067,වාසනා එමෙ නැත්තං චේතනා බඩුව කියලද උඹ කියන්නෙ ?,1
1061269154148171776,අර පරයා දැන් දාල තියෙන ඩිපිය කලින් ඒවට වඩා පට්ට හැන්ඩි ලව්ලි ලුක් එකක් තියෙන්නෙ කියල හිතෙන්නෙ මට විතරද                                                   කියන්න හොද නෑ ඕකා උඩ යන්න ගනී  ඩෙඩ්මෑන්ස්ක්‍රීඩ්ඩිපීඇප්‍රිසියේසන්ට්වීට්,1
1397095543084511233," ,     පලයන් යන්න",0
1021832359010697217,"""උඹ එන්නෙ නැත්නම්  මගෙ හීනත් ගියාවේ  ඔන්න ඔහේ පාළුවට  ""  ඒ මේ තත්පරේ උඹේ හිත නේද ?   නොදන්න විදිහට නොදැනෙන විදිහට මං මග අරින ඒ හිත නේද ?   මං කියන්නෙම ,  ජීවිතේ අරන් ඇවිත් උඹ මේ ඇස්වල නම් නවතින්න නරකයි  සමහරක් ජීවිත කාටවත් අයිති නෑ බන් ආදරේ එහෙමයි  ගොන්ට",0
1373549640738512897,"දාහක් මිනිස්සු අතර තාමත්, ඒ ඇස් දෙක හොයන  ""හිත"" උඹ නම් සාපයක් බන්",1
1218940940754120705,පරන  නොසිතූ වෙලාවන් වලට දැකීමෙන් සිත රිදිය හැක මෙවන් කරුම අනිත් අයට නොවේවා,0
886797259479719938,හම්මද බොල යකෝ මාව බ්ලොක් කරා නම් මාත් බ්ලොක් කරනවා,0
929754295204945921,   නාග කන්‍යා වේසි,1
1309121682460889090,  තෝ මට හායි කීවේ නෑ,0
1281479537545498624," දැන් ඉන්න ගොබ්බ මාධ්‍ය වල හැටි! ජංගම දුරකථන වලට අකුණු නොවදින බවත්, ගස හරහා අකුණ වැදුණු බවත් නොදන්නා ගොන්නූ",1
1209868559138066432,  හරි බන් උබ පාටලි ගැන කියලා නැ එලට්ව්ට් වලට රිප්ලයි වැටෙන එක අවුල් නම් ඔක ප්‍රයිවට් එකවුන්ට් ක් කරගනින් අනිත් මිනිස්සුන්ට ට්වීට් නොපෙනෙන්නඑහෙම නැතුව ට්වීට් කට රිප්ලයි දැම්මම උබෙ ගැනි අපි ගත්තා වගෙ ගොන් ටෝක් දෙන්න එපා ට්ව්ටරෙ පබ්ලික්නෙඒක නොතෙරෙන ගොබ්බයෙක් දැක්කමයි,1
760141018410971136,"“නැපයියා” දඩයම් අරමුණ පෙරදැරිව“කික්කි” සමග වනයට යන්නේයවල් ඌරකු, ගෝනකු, මුවකු වැනි සතෙකු දඩයම තමන්ට සහ  “කික්කි” ",0
1237706389616615424, නිවැරදි කිරීමයි: යලි බන්ධනාගාර රෝහලට,0
1120593444953448453, ඔකාව අල්ලන් ඉන්න ඔනේ ඔක්කෝටම කලින්,0
1379415234654347270,   අනේ හුත්ත බොරු දාන්නැතුව හිටපන් පකේ ඇඩ්මින්,1
1137215745778044929,ඉඳල ඉඳල ගෙදර හිටිය ශොපින් පාරක් යන්න කියල උදේ ඉඳං වහිනවා  රෙද්ද,0
1476136531056152576, උඹලා එකතුවෙලා කරන ලද නාට්‍යක් ඕක,0
1410646285363859457,අහස පළාගෙන පෑයූ වළාවක දේදුන්නක පාට තැවරූ බව වෙලිපනැල්ලේ දිය කඩිතිවල කූඩිත්තන් දග කෙරූ බව ඉස්පාසු නැතිවිය උඹට කීමට  හෙරළිය යස අගේ පීදෙද්දි සප්පායම අගේට කදිම බව දොඩන්නේ උඹ මන්තරේ සේම ඉදින් අපූරුයි අද පිල්කඩේ ඉද උඹත් එක්කන් බුදින බත් වේළ  උඹට මා මෙන්ම මටද උඹ විනා මක්කටද කවුරුත් නේද?,0
636852020947750912,"ඉස්කෝලෙ යන කාලෙ සින්හල පොතේ තිබ්බ කවි වල පද පේළිවල අන්තිම වචනෙ මුලට 'දෙක' කියල දාල කියවනකොට පට්ට යකූ < දෙක දනවෝ, දෙක දෙනවෝ ^_^ ",0
1439835761637949445,කැත වැඩේ මගෙන් ක් ගන්නවා ඕයි     ,0
