post_id,text,label
1059416568352755714,පාන් කාලයි අරක්කු පැකට් එකටයි ලෙවකාගෙන වැස්සෙ තෙමීගෙන කඩේයන වහල් හැත්ත,1
997566060093198337,පොඩි කෙල්ලගේ කිම්බෙ පයිය අතුල්ලනවා,1
1140479165352820736,මූ දන්නෙ පඩිපෙලේ උඩට නගින්න විතරයි පල්ලෙහාට බහින්න පට්ට බයයි හෙන ගොනා,1
757889540430270464,පාද යාත්‍රාවට බිය වි ඇදේම හුජ්ජ යන සිරිසේනට ශිරාල් රුවන්ගේ වෙබ් පැම්පරය අන්දවයි  පාද යාත්‍රාව හමුවේ බියෙන් සලීතව ,1
1071008807168413696, මහින්ද රාජපක්ෂට සහ ඔහුගේ පවුලේ අයට කඩෙ යන එක නවත්වන්න,0
1130148982045286401,"කාර් කෑල්ලකුයි, අයිෆෝන් එකකුයි තිබුන කියල අර ගොනා හිතන් ඉන්නෙ ඌට කෙල්ලො කැමති වෙයි කියල",1
1400785892017524742, කුරුණෑගල පොලිසියේ තිබ්බ පාටියේ සීසීටීවී නැද්ද ? නිව්ස් නැද්ද හුත්තෝ මේ ඉවර වෙච්ච නිව්ස් එකක් අල්ලං දඟලන්නේ,1
1153571690808373249,ඉස්සෙල්ලා ආවෙ බිත්තරෙද කුකුලාද කියලා ගොන් ප්‍ර්ශ්න අහලා අවදානවැස්සියෙක් වෙන්න එපා,1
1190138705882697728,යන්නෙ ගෙදරක් තියද ඉන්න රටක් නැති කොට නොදකින් පකිස් බූරුවා      ·    හැමදාම මට බැනලා ගෙදර යන්න පුළුවන් සමාජයක් අද තියෙනවා-අගමැති වැඩි විස්තර - ,1
920916788916789249,සල්ලි තිබ්බත් කොලිටි බඩුවක් ගන්න බැරි කාලකණ්ණි රටක් බන් මේක,1
1229569732229128192,බඩගිනි යකෝ කන්න දෙයක් අරන් දීපල්ලකෝ පාඩම් කරන ළමයෙක්ට මොනවත් කන්න අරන් දුන්න කියලා උඹලට මුකුත් වෙන්නෙ නෑ,0
954229942006370304,සහතික ඇත්ත ඕවා අපේ සත් ගුණවත් නලලේ බුද්ධාගම කොටන් ඉන්න කට්ටිය හදාගත්තු බහුබූත තමයි ළමයෙක් ඉපදෙන්නෙත් අම්මා ගෙන් එහෙව් ගෑණි ගෙ කිලි ලු පන්සල ඇතුලට එද්දි     ,0
1403709797564764164,ලීටර්  කරලා ගැහුවා මදිවට දැන් රුක් වැඩි කරලා අපිව නැති කරන්නද යකෝ හදන්නේ? ගෑස්වලගෑස්,0
1403849528365641732," ,     බළලුන් ලව්වා කොස් ඇට බානවා",0
1260902604651081728, ඈ නානි පකෝ හරි දේට හරිකියන්න වැරදිදේට වැරදි කියන්න ඉගෙනගනින් බොරැවට මහිනදගේ පයිය ඉබ ඉබ ඉන්නෙ නැතිව මොන ජාතියෙ මොන ආගමේ මොන පක්සෙ එකෙක් හරිදෙයක් කලොත් හරි කියන්න සතුටු වෙන්න වගේම කවුරැහරි වැරදදක් කලාම බය නැතිව වැරදි කියල විවේචනය කරන්න ඉගෙන ගනින්දැන් ඉතින් මොනව ඉගෙන ගන්නද,1
954953844605112320, බිව්ව නොබිව්ව කෙසේ වෙතත් ඔය කොයි කවෘත් බලන් ඉන්නෙ රෙද්ද අස්සෙ රිංඟන්න තමා,1
1067427193184124935, ඔය දෙකෙන් එකක් ජනපති මැදුර පැත්තට හරවන්න බැරිවෙයි ද???,0
980847051268378626,   තෑන්කූ තෑන්කූ ඩාලින්,0
1187183879289016320,   පලයන් බන් බොරු නොකියා උබ නිදා ගනි කොට්ට නැතිව මන් උබේ රූම් මේට් මන් දැකලා තියෙනවා උබ රුවිතෙට නිදන් ඉන්න හැටි,0
916670417963806723,"අම්මෝ ලිටරේට කිලෝමීටර් ක් වැඩලු : මේ සතියේ හුම්මානේලු, ලබන සතියේ දියලමලු පුක නැතුව ඇති : : :  මොනවා ",1
602549720939175936,   එකෙ බොල හයකට ඔවර් කියක් තියනවද?,0
1465886947528757250,"දහ අටවන මාසයේ බැල්ලි ඇතින්නිය ළඟට ගොස්, ඔබ ගැබ්ගෙන ඇති බව ඔබට විශ්වාසද? අපි එකම දිනයක ගැබ් ගත්තා මම බලු පැටවුන් දුසිමකට තුන් වතාවක් දරු ප්‍රසූතියක් කර ඇති අතර ඔවුන් දැන් විශාල බල්ලන් බවට පත්ව ඇත නමුත් ඔබ තවමත් ගැබ්ගෙන ඇත කුමක් සිදුවේද?",0
1335330200192569348,තඩි පූසා කවදාවත් නැතුව මගේ ළඟ නිදි  මූට මොනව වෙලාද මන්ද,0
1201952858863595520, අපේ ගරු ජනාධිපතිතුමනි ! මෙතරම් සමාජ මාද්‍ය දියුණු කාළයක යම් පුරවැසියකුට කිසියම් කාණ්ඩ යටතේ තම එකම පණිවිඩයක් හෝ ඔබතුමාගේම කියවීමට ලබාදිය හැකි වන ලෙස යම් පණිවිඩ කවුලුවක් විවෘත කරන්නේ නම් ඔබතුමාට රටතුළින්ම සම්පත් දායකයින් තොගයක් රටේ දියුණුව උදෙසා එක් කරගනු හැකිවෙතැයි මගේ විශ්වාසයයි,0
1347179478967992324, සම්පුර්ණ විඩියො එක බැලුවා මිග් වංචාව ගැන ඇහුවම කියනවා යහාපාලන ආණ්ඩුවට වඩා ඔහු දක්ෂ වුනාලු ඒකයි අල්ලන්න බැරි වුනෙලු තමන් වැරදි බව ඔහූම ඔප්පු කලා,0
745112101316788226,විවාහය අමු අඹයක් වැනිය  කන උන් දෙස බලා සිටින ඒකාගේ කටට කෙල උනයි කෑ එකාගේ දත් හිරි වටී දගලයි ,0
1291742412109357058," තොට පිස්සුද හු%& අම්මා ඇහුවා මොකක්ද කියලා, වෙලාවට ලෙබනන් ගින්න කියලා ෂේප් උනා ගෑනියෙක් ගිනි අරන් කියල නොදකින් තෝනම්",1
594765706966663168,අදවත් නිවාඩු පාඩුවෙ මංගල කිංකිණි කෑල්ල බලන්න!,0
1436583550464126983,ඇයි අපි කියනව ඒවා බල බල ලෙවකන්නෙ?   පාඩුවෙ වැඩක් බලාගෙන ඉන්නවකො අයිසෙ? තමුසෙගෙ   වැඩ කරන්නෙ නැද්ද?  අනුන් කරන් දේවල් වලට හොට දාගෙන රෙන්නෙ නැතුව තමුසෙග වැඩක් කරගන්නවකෝ  මොන්ගල් පයිසෙලා හිතන් ඉන්නෙ හැමදෙටම බැන්නම හරි ප්‍රොෆෙෂනල් කියලා     ·       විදිහට පටන් ගත්තු  එකක් දැන් ලැට් වලක් ගානට වැටිලා  වියත්මගට උනෙත් ඔය ටිකමයි,1
1122839996824580098, අතල් එකටද වතුර කපන්නේ හෙතුවක් නැද්ද,0
1413131146255237123, උබලගෙ ප්‍රවෘත්තිත් වෙපා කාලකන්න,0
1453002063298932744, ක්වින්ඩාඕ නෙවෙයි යකෝ ඡිංදාඹ්,0
1072315647315664897, අනේ බොල!!  තෝ හරි එක කිව්වත් ඒක හරී කියලම කියයි,1
760047805486465024,ගොනා පසු එන රිය සකට මහින්ද උපමා නොවේද?    ,0
1389181285231325185,   ඇරපං කටට මසුරමක් දාන්න,0
977631626531188736,මඩ ගහන්න එපා බම් මහත්තුරුන්ට ඕව පලදෙයි තොට,0
632059973271326720,"""බිජ්ජ තියාගෙන ඇට දෙකෙන් **න්න ලෑස්ති වෙන්න එපා"" - ප්‍රසන්න රණතුංග ",1
1062358366050111488,අර   කරපු වීඩියෝ එකේ වයසක අයට බනින එක වැරදී කියලා ඌට බනින උන්මයි උන් කෑල්ල එක්ක යද්දි එකෙක් බැලුවම මොනාද හුත්තෝ බලන්නේ අහන්නේ  වයසක උන් තමා ගොඩක් වලත්ත සැකනම් බලපන් බස් එකක පොඩි කෙල්ලොන්ට ජැක ගහන්නේ මොක්කුද කියලා,1
1258692932288286720, එතකොට  මුලු රටම ආයෙත් කලින් වගේ අරිනව කියලද කියන්නෙ?,0
1255518057826525184, මේ පාර මතකද ? දැනට අවුරුද්දකට කලියෙන් වගේ අපිත් ගියාබන් නොකා නොබී පිස්සෝ වගේ කදු පල්ලම් අතරින් හරි මරු දිග කතා පිරුන ගමනක්  හිරුවා : යකෝ හිතුවට වඩා ලෙස්සනවා බන් පෙරලෙයිද   ඊලග වංගුවේදී කිව්වේ අන්න එහෙම… ,0
1304552468039122944, පයිය තලන්න ඔන ඔකූන්ගේ,1
913605400355672064," විලි ලැජ්ජයි ,ලොක්කගේ ඩිල් එලි කලාම සහෝදර මිඩියා එවුනටත් කෙලිනවා නේ බොලාව ගිනිතිබ්බ වෙලේ කතා කලේ ඕකුන් විතරයි ,ඩිල් දාන එවුන් කොහෙද හිටියේ",0
740782783040266240,සිරාවටම මුන්ට නෙමේ බං ගහන්න ඕනේමේවගේ කාලකණ්ණි වේසිගේ පොන්නයෙක් හදපු මහ උන්ට ,1
1000284619030212608,අම්ම කියල තියෙන්නෙ උබව ටෝක් කරල කෙල්ලෙක් ඇවිත් දාගන්න කම් උබ එහෙම කෙල්ලො පස්සෙ යනව නෙමෙයි කියල           ,0
751409836856733696, ඒකි පට්ට කෑල්ල ඕයි,0
1429837282593284096, වර්ජනයක් වෙනුවෙන් පාරට ටිකක් බැහැලා නැටුවට නං එච්චර අවුලක් නැතිව ඇති නේද බං,0
969210415409278977,මයි මයින්ඩ් ඊස් බ්‍රෙක් බිකොස් අම්මා බැන්නානිවාඩු දවසේ තෝ අවිදින්න ගියා කියලා,0
1164485669416140800,ඒක පට්ට   සෙප්‍රනෝ ඔකියෝපියර්ස්    ·    ගූගල් මැප් ගිහින්  කියලා ගහල බලපංකො කවුරු වුණත් කරපු එකා,1
940019566134091777,ඔය පොස් කියල කියන උන් ඉස්ටේටස් මේන්ටේන් කරනව කිව්වහම හෙන ලොකුයි පට්ට  හදිස්සියෙ හරි අපි ඉස්ටේටස් මේන්ටේන් කරනව කිව්වොත් ඒක අපේ ලොකුකම අලි ඔලුව සහ ගොංපාට්  අනේ ඔය ලොජික් අරන් පලයන් මහත්තයො යන්න,0
779522769801273344,   දැං ඉතිං මේක දැක දැක පහලට යන්නැතුව ලැයික්ස් එකක් රීටිවිට්ස් එකක් දාපල්ලා හැත්ත,0
1338531932074754053,"හරක් මරා මස් අපනයනය කිරීම පට්ට් කුසල කර්මයක් වන අතර මෙරට අනුභව කිරීම පට්ට අකුසල කර්මයකි,,,!!! මැඩවිල්ලේබන",0
918786720081920000,ටයිම් ලයින් එක දැකලා පක නැග්ගාද යාළුවනේ?,1
1271812134066745344, ගෑණි හොර මිනිහෙක් ගාවට යන පලවෙනි දවසේ ඉඳලා දැන දැන අවජාතක ළමයාට උප්පැන්නෙ දෙන්න වෙනකොට ගෑනිගෙ පතිවත ගැන කතා කරන්නේ කවුද අයියා,0
608092084025688066, ජකූ මම මේ උදෙපන්දරම නැගිටලා රැකියාව බල යන ගමනේ නෙත ගැටුනු සුන්දර දෙයක් ගැන කිව්වෙ බොල  (ඇය මා හා සිනාසෙයි මම ඇය හා සිනාසෙයි),0
1209782388752048128,   ඒක පැහැදිලිව දාපන් එක්කෝ වරහන් වල   තෝ   ම වෙන්න ඕන ගොං බූතයා,1
898439915616124930,  මේ පොන්න හුකන්නා ආයේ පුත්තලමේ මගේ ඇස් දෙකට පේන්නනම් එන්න එපා කැරි හම්බයා,1
881503198023892992,නාකි බල්ලො කොළඹ යන්නෙ කොහොමද,1
628192992004681728,කුරුණෑගල මහිංද රාජපක්ශ කාර්යාලය තුලදී පිස්තෝලයක් සමග හමු වූ සැක කටයුතු පුත්ගලයා පිලිඹද තොරතුරු කු/ගල පොලිසියට වාර්ථාවී නැත එහෙත් එම /,0
1370018911840661513, ඒක ඒකාලෙම කරා නම් හොදයිනෙ,0
791313757964214272,පිස්සා තමන්ගේ හිතට එන මුල්ම අදහස කවදාවත් අත් නොහරී,0
1297149919665430529,හැමනෙන්න හුකන්නැතුව ඕක නවත්තපන් පයිය ගොටුකොළ පොන්නයොයි තුත්තිරි වේසාවියොයි මේ හුත්තේ වලි දාගෙන,1
735526365215084544," ඒක තමයි ඇත්ත, ඡන්දේ කාලේ කියපු පට්ට බොරු වලට අහු උනා කියලා පිලිගන්න කැමති නෑනේ, ඒක නිසා මේ වෙන දේවල් හරි කියලා කියන්න හදනවා",0
590201502930731008,"'නාතන් මෝඩයා  ""ඉතා මෝඩ <",1
729602863748550656,කෙල්ලොන්ට වඩා බල්ලො සෝක් බන් කෙල්ලො දාල ගියත් බල්ලා දාල යන් නෑ ඔය කෙල්ලො වෙනුවෙන් දෙන ආදරෙ බල්ලෙක් වෙනුවෙන් දුන්නට පාඩු නෑ බන්,0
847983843395211265,"   බුබුලුගෙන් නෙමෙයි බන්, උබෙන් තමයි ගොන් කතා අහගන්න වෙන්නෙ  කට ඇරියොත් අනාතයිනේ ඉතින්",1
1372538730087522304,ඉස්සර කාලෙ සිගරට් බොනවා කියන එක හෙන රෙස්පට් දෙයක්කෝට් බෑයක් ඇඳලා සිගරට් එකක් බොන ෆොටෝ ගෙවල් වල ඉස්සර හරි තේජසින් තිබිලා තියෙනවා,0
938944520296599552,ගමෙ පාරක තොටක යද්දි හුජ්ජ බරක් හැදුනට අල්ලන්න බැදි කුට්ටියක්  නෑහැමතැනම ගෙවල් තට්ටු නිවාසවලට නොයා හැමෝම ඉඩං අරං ගෙවල් හැදීමෙන් ලොකු විනාසයක් වෙනෝ රටට පරිසරේට,1
1428754049336156165,   අනිවාමට හිතෙන්නෙ නම් වෛරස් එක ගැන අපි දැනගන දැන් අවුරුදු ක් විතර වෙනවාසෞඛ්‍ය අංශ කරන්න ඕනෙ උපදෙස් ටික දීල තියෙද්දි අපිට ලෝකෙ කිසිම රාජ්‍යයකට චෝදනා කරන්න බෑ අපෙන් වෙන්න ඕනේ කොටස අතපසු කරලාඒ හින්දා තමන්ගෙ ජීවිතේ දේශපාලුවෝ රැකල දෙනකල් බලන් ඉන්න තරම් මෝඩ වෙන්න හොඳනෑ,1
1465886944441733123,"අමාරුවෙන් ලැබෙන දෙය හැම විටම ශ්‍රේෂ්ඨයි !  ඇතින්නියක් සහ බැල්ලියෙකු එකවර ගැබ් ගත්තේය මාස තුනකට පසු බැල්ලි බලු පැටවුන් හය දෙනෙකු බිහි කළේය මාස හයකට පසු, බැල්ලි නැවත ගැබ්ගෙන ඇති අතර, මාස නවයකදී එහි තවත් බලු පැටවුන් දුසිමක් බිහි කළේය රටාව දිගටම පැවතුනි",0
1155860415622057984,"ලොකු ටෝක් දීලා ඉල්ලල අස්වෙච්ච මුස්ලුම් ඇමතිලා ආපහු දිවුරුම් දීලාඇත්තටම ලැජ්ජාවක් කියලා දෙයක් නැත්තෙ ඒ කැළණි හිඟන්නන්ටද, නැත්නම් උන් කියන කියන පදේට නටන පොන්න ආණ්ඩුවටද ?  දැකලා_හිතුණා",1
1347846379255656456,"මම චනදෘ ගෙන් ඇහුවා උඹ හිතන්නේ මොන භාෂාවෙන්ද කියලා ඌ මට කිව්වා ""මම සිංහලෙන් හිතන්නේ ඒත් අමාරු දේවල් දෙමලෙන් හිතන්නේ ""කියලා",0
1390729966363447297,මොන්ගල්ද ඩාලින්    ·             ,0
597223286926217217,අපි වෙනුවෙන්  කොන්දේසි විරහිතව  ජීවිතය වුනත් දෙන්නේ  අපිට ජීවිතය දුන්න රත්තරන් අම්ම විතරමයි  ,0
1166270771511119872,"මහින්ද රාජපක්ෂ  දී මිනිහා  වෙනි පාරටත් ජනාධිපතිවරණය ට තරග කරනවා කියලා මිනිස්සුන්ට කියපු කතාවේ වීඩියෝ එකක් බැලුවා   එදා හෙන ටෝක් දෙනවා  ""මේක තමයි """"ප්‍රජාචන්ත්‍ර වාදය """" කියන්නේ  අපේ රටේ මිනිස්සුන්ට දෙමු හොඳම පාරජිතයා තෝරන්න ""       ",0
907785512362143746,අනුන්ට කොච්චර මොනව කරත් අන්තිමට අපිට අපි විතරයි  එකෙක් එන්නෙ නෑ  තමන්ට තමන්ගෙ පිහිට විතරයි අම්ම තාත්ත නැති දවසක  —  ,0
1115629744278528000, අපිත් පිස්සු වැටිලා වගේ බිව්වේ,0
1383599300433747968,"* දාන පෝස්ට් වලට පැල් බැදගෙන මයින්,බබා,මැනික,පැටියෝ කියා කොමෙන්ට් දාන් ලොන්තපොල් කිබි සිබා සෙට් එක  * අපි මොනා හරි කිව්වොත් පයිය පොඩී /  ගාගෙන එන වට්ටි අම්මලා සෙට් එක  * අවසානෙට ලීක් කරගෙන අතුරුදහන් වීම",1
630735372457132032,"හම්බයෙක් මැරුවොත් අපේ උන්ට හෙන අමාරුයි  කාරයො ,  මරපු ඒවත් ගොඩ දාල බලපල්ලකො ඉවරයක් කරන්න පුලුවන්ද කියල ",1
1247237577565859840, උඹෙ පයිය ගිනිගන්ඩ ඇති මුලින් එකි බ්ලොක් කරන්ඩ ඇති,1
707275623492792320,යා තව නාකි වූ වගයි පාටිය හෙට රෑට කොට්ටාවේදී එන වුන් වරෙල්ලා මෙකී නොකී හැමෝම එන්ට,0
1270410669750353920,"දැන් ලංකාවෙ  එම්බසියට රෙද්ද රෙවිල ඇත්තෙ   මොකද අපේ උන් ඕක නිවුස්වල දැකල හූල්ලල, ,  මොකක්හරි දාල නිකන් ඉඳී,   ඒත් මොකක් හරි කරුමෙකට ඕක  නිවුස් එකක ගියොත් හෙට එලිවෙද්දි මුන් ස්ටේට් ඩිපාර්ට්මන්ට් එකත් වටකරල තියෙයි",1
1481593042289106950, සිරස තාමත් මොකට දානවද මෙයාගෙ වැදි බණ,0
1424460204427464705,නිකමට මේක කියවහන්කෝ ඉංග්‍රීසි එච්චරම ක්ලින් නැත්තන් ට්‍රාන්ස්ලේට් දාලා හරි කියවහංකෝ පිස්සු හැදෙනවා     ·         :                                 ,0
944574181030727681,  අතල් දෙන්න එපා ,0
1015041187198058496,   ඒක ඉතින් උබෙන් අපි අහන්න ඕන දෙයක්නේ හුජ්ජ බන්ඩෝ,1
1398136620717469696, නෑ බං ඊයෙ හවස දාලා තියෙන්නෙ තාම බැල්ලි ආවෙ නෑ,1
749607311920869376, උබ පලයන් මල්ලීයේ මටනම් බෑ ඕන් කිවුවා,0
1367094276392292357,කසාද බැඳපු පිරිමියෙක් කියලා දැන දැනත් ගෑණියක් උඹට ඕනෑවට වඩා ආලේ පාලා රෙද්ද කඩාගෙන දඟලනවා නම් ඒ එන්නේ උඹේ සල්ලි වලට හරි  එකට හරි වෙන ලාබයක් බලාගෙනමයි  ඕක තේරුම් ගන්න බැරි උනාම ලොවෙත් නැති ප්‍රශ්න,0
916625775385772032,පිස්සා මූ පිස්සා මූ පිස්සු පූසා මූ []:  ,0
694922469421948928,  මහින්ද රාජපක්ෂ මහත්තය දැන් දරුණු වෙලා නේද?? වෙනද වගේ නෙවෙයි දැන් දැඩි උත්තර දෙන්නෙ ඔහොම තමයි ඉන්න ඕනෙ :-) ,0
669135984999710720," ""  : රාගමදී දුම්රිය දෙපාර්තමේන්තුවට සිදුවූ හානිය මගීන්ගෙන් අයකර ගැනීමට පියවර  "" ",0
764883752006713344, හොඳ වැඩේ තොට බඩජාරියා :,1
1356641261801922560, මේක ව්‍යාග්‍රා නැගිටීමේ   අවසානේ!!!!!,0
